{
  "schemaVersion": "1.0.0",
  "model": "sarima",
  "metric": "arrivals_total",
  "geo": "MV",
  "horizon": "12m",
  "points": [
    {
      "ds": "2026-05-01",
      "yhat": 152877.34144879153,
      "bands": [
        {
          "level": 80,
          "lower": 139933.18019578725,
          "upper": 167018.86070474653
        },
        {
          "level": 95,
          "lower": 133530.69068253916,
          "upper": 175027.01892696638
        }
      ]
    },
    {
      "ds": "2026-06-01",
      "yhat": 153960.65225023177,
      "bands": [
        {
          "level": 80,
          "lower": 139364.647237832,
          "upper": 170085.32208459036
        },
        {
          "level": 95,
          "lower": 132206.76244318206,
          "upper": 179293.99694700958
        }
      ]
    },
    {
      "ds": "2026-07-01",
      "yhat": 197153.78963338793,
      "bands": [
        {
          "level": 80,
          "lower": 177597.35531713543,
          "upper": 218863.70179284998
        },
        {
          "level": 95,
          "lower": 168042.74952241266,
          "upper": 231307.87751466891
        }
      ]
    },
    {
      "ds": "2026-08-01",
      "yhat": 207935.15551337184,
      "bands": [
        {
          "level": 80,
          "lower": 186679.4810416675,
          "upper": 231611.0278264682
        },
        {
          "level": 95,
          "lower": 176321.61782595303,
          "upper": 245216.80190650624
        }
      ]
    },
    {
      "ds": "2026-09-01",
      "yhat": 165107.9363582421,
      "bands": [
        {
          "level": 80,
          "lower": 147801.74086506298,
          "upper": 184440.51106939232
        },
        {
          "level": 95,
          "lower": 139387.2576811899,
          "upper": 195574.73441875973
        }
      ]
    },
    {
      "ds": "2026-10-01",
      "yhat": 210015.43116986746,
      "bands": [
        {
          "level": 80,
          "lower": 187494.44369855546,
          "upper": 235241.52371828433
        },
        {
          "level": 95,
          "lower": 176567.28416891544,
          "upper": 249799.8154121975
        }
      ]
    },
    {
      "ds": "2026-11-01",
      "yhat": 211738.10391873852,
      "bands": [
        {
          "level": 80,
          "lower": 188540.8033262187,
          "upper": 237789.49174966593
        },
        {
          "level": 95,
          "lower": 177308.08741511373,
          "upper": 252853.76780638355
        }
      ]
    },
    {
      "ds": "2026-12-01",
      "yhat": 250071.27345972703,
      "bands": [
        {
          "level": 80,
          "lower": 222110.6708100012,
          "upper": 281551.70601161325
        },
        {
          "level": 95,
          "lower": 208597.90079986327,
          "upper": 299790.33022045856
        }
      ]
    },
    {
      "ds": "2027-01-01",
      "yhat": 246907.8260943386,
      "bands": [
        {
          "level": 80,
          "lower": 218758.2719355636,
          "upper": 278679.6148323694
        },
        {
          "level": 95,
          "lower": 205180.17634082408,
          "upper": 297121.618607166
        }
      ]
    },
    {
      "ds": "2027-02-01",
      "yhat": 263418.6645342527,
      "bands": [
        {
          "level": 80,
          "lower": 232821.10653680578,
          "upper": 298037.36369107285
        },
        {
          "level": 95,
          "lower": 218089.82487534222,
          "upper": 318168.8253606064
        }
      ]
    },
    {
      "ds": "2027-03-01",
      "yhat": 246832.7909615832,
      "bands": [
        {
          "level": 80,
          "lower": 217643.30226169783,
          "upper": 279937.0444483558
        },
        {
          "level": 95,
          "lower": 203615.7350936788,
          "upper": 299222.54040514224
        }
      ]
    },
    {
      "ds": "2027-04-01",
      "yhat": 231386.75909680815,
      "bands": [
        {
          "level": 80,
          "lower": 203547.9999943979,
          "upper": 263032.93807543186
        },
        {
          "level": 95,
          "lower": 190193.65610287103,
          "upper": 281501.6255568614
        }
      ]
    }
  ],
  "backtest": {
    "baseline": "seasonal_naive",
    "mase": 0.7628,
    "smape": 6.7395,
    "pinball": 2868.4423,
    "folds": 30
  },
  "lineage": {
    "runId": "6c13df22-fc36-445a-aebb-ebfaf533c9b4",
    "gitSha": "6f8c7c5",
    "inputHash": "sha256:96b1b42b92ab02e4bb27324ff7596748502f1e88171befdf504f30fa92ba18b0"
  }
}
